"-----Welcome to Employee Payroll Service Program on MySQL DB---------------"
----------------------------------------------------------------------------
UC1 -> Create a Database payroll_service and show and used that  data base
----------------------------------------------------------------------------


mysql> create database payroll_service;
Query OK, 1 row affected (17.20 sec)


mysql> show databases;
+--------------------+
| Database           |
+--------------------+
| firstdatabase      |
| information_schema |
| mysql              |
| payroll_service    |
| performance_schema |
| sys                |
+--------------------+
6 rows in set (2.49 sec)

mysql> use payroll_service;
Database changed

-------------------------------------------------------------------
UC2 -> Created Table Employee_Payroll into Payroll_Service Database
-------------------------------------------------------------------

mysql> create table employee_payroll
    -> (
    -> id int unsigned NOT NULL AUTO_INCREMENT,
    -> name varchar(160) NOT NULL,
    -> salary double NOT NULL,
    -> start date NOT NULL,
    -> Primary key(id)
    -> );
Query OK, 0 rows affected (8.65 sec)

mysql> describe employee_payroll;
+--------+--------------+------+-----+---------+----------------+
| Field  | Type         | Null | Key | Default | Extra          |
+--------+--------------+------+-----+---------+----------------+
| id     | int unsigned | NO   | PRI | NULL    | auto_increment |
| name   | varchar(160) | NO   |     | NULL    |                |
| salary | double       | NO   |     | NULL    |                |
| start  | date         | NO   |     | NULL    |                |
+--------+--------------+------+-----+---------+----------------+
4 rows in set (4.92 sec)


-----------------------------------------------------------------------------------
UC3 -> Inserted employee data in table employee_payroll of payroll_service database
------------------------------------------------------------------------------------

mysql> Insert into employee_payroll(name,salary,start)values
    -> ('Bhagyashree',15000.0,'2017-06-07'),
    -> ('Basavaraj',20000.0,'2018-10-08'),
    -> ('Aishwarya',30000.0,'2019-09-05');
Query OK, 3 rows affected (1.66 sec)
Records: 3  Duplicates: 0  Warnings: 0

-----------------------------------------------------------------------------------
UC4 -> Retrieved all employee data from table employee_payroll of payroll_service database
------------------------------------------------------------------------------------

mysql> select * from employee_payroll;
+----+-------------+--------+------------+
| id | name        | salary | start      |
+----+-------------+--------+------------+
|  1 | Bhagyashree |  15000 | 2017-06-07 |
|  2 | Basavaraj   |  20000 | 2018-10-08 |
|  3 | Aishwarya   |  30000 | 2019-09-05 |
+----+-------------+--------+------------+
3 rows in set (0.19 sec)


---------------------------------------------------------------
UC5 -> Ability to retrieve salary data for particular employee 
---------------------------------------------------------------

mysql> select salary from employee_payroll where name = 'Bhagyashree';
+--------+
| salary |
+--------+
|  15000 |
+--------+
1 row in set (0.61 sec)

mysql> select * from employee_payroll where start between cast('2017-06-07' as date) and date (now());
+----+-------------+--------+------------+
| id | name        | salary | start      |
+----+-------------+--------+------------+
|  1 | Bhagyashree |  15000 | 2017-06-07 |
|  2 | Basavaraj   |  20000 | 2018-10-08 |
|  3 | Aishwarya   |  30000 | 2019-09-05 |
+----+-------------+--------+------------+
3 rows in set (0.13 sec)


---------------------------------------------------------------------------------------
UC6 -> Added gender field into table and updated the table according to employee gender 
---------------------------------------------------------------------------------------

mysql> alter table employee_payroll add gender char(1) after name;
Query OK, 0 rows affected (6.13 sec)
Records: 0  Duplicates: 0  Warnings: 0

mysql> describe employee_payroll;
+--------+--------------+------+-----+---------+----------------+
| Field  | Type         | Null | Key | Default | Extra          |
+--------+--------------+------+-----+---------+----------------+
| id     | int unsigned | NO   | PRI | NULL    | auto_increment |
| name   | varchar(160) | NO   |     | NULL    |                |
| gender | char(1)      | YES  |     | NULL    |                |
| salary | double       | NO   |     | NULL    |                |
| start  | date         | NO   |     | NULL    |                |
+--------+--------------+------+-----+---------+----------------+
5 rows in set (0.71 sec)

mysql> update employee_payroll set gender ='F' where name ='Bhagyashree' or name='Aishwarya';
Query OK, 2 rows affected (0.14 sec)
Rows matched: 2  Changed: 2  Warnings: 0

mysql> update employee_payroll set gender = 'M' where name = 'Basavaraj';
Query OK, 1 row affected (0.04 sec)
Rows matched: 1  Changed: 1  Warnings: 0

mysql> select * from employee_payroll;
+----+-------------+--------+--------+------------+
| id | name        | gender | salary | start      |
+----+-------------+--------+--------+------------+
|  1 | Bhagyashree | F      |  15000 | 2017-06-07 |
|  2 | Basavaraj   | M      |  20000 | 2018-10-08 |
|  3 | Aishwarya   | F      |  30000 | 2019-09-05 |
+----+-------------+--------+--------+------------+
3 rows in set (0.00 sec)


--------------------------------------------------------------------------
UC7 -> Found Sum,Average,Min,Max And Number of Male and Female Employees
--------------------------------------------------------------------------


mysql> select sum(salary) from employee_payroll where gender ='F' group by gender;
+-------------+
| sum(salary) |
+-------------+
|       45000 |
+-------------+
1 row in set (0.13 sec)

mysql> select sum(salary) from employee_payroll where gender ='M' group by gender;
+-------------+
| sum(salary) |
+-------------+
|       20000 |
+-------------+
1 row in set (0.00 sec)

mysql> select avg(salary) from employee_payroll where gender ='F' group by gender;
+-------------+
| avg(salary) |
+-------------+
|       22500 |
+-------------+
1 row in set (0.08 sec)

mysql> select avg(salary) from employee_payroll where gender ='M' group by gender;
+-------------+
| avg(salary) |
+-------------+
|       20000 |
+-------------+
1 row in set (0.00 sec)

mysql> select min(salary) from employee_payroll where gender ='F' group by gender;
+-------------+
| min(salary) |
+-------------+
|       15000 |
+-------------+
1 row in set (0.01 sec)

mysql> select min(salary) from employee_payroll where gender ='M' group by gender;
+-------------+
| min(salary) |
+-------------+
|       20000 |
+-------------+
1 row in set (0.03 sec)


mysql> select max(salary) from employee_payroll where gender ='F' group by gender;
+-------------+
| max(salary) |
+-------------+
|       30000 |
+-------------+
1 row in set (0.13 sec)

mysql> select max(salary) from employee_payroll where gender ='M' group by gender;
+-------------+
| max(salary) |
+-------------+
|       20000 |
+-------------+
1 row in set (0.00 sec)

mysql> select gender,avg(salary) from employee_payroll group by gender;
+--------+-------------+
| gender | avg(salary) |
+--------+-------------+
| F      |       22500 |
| M      |       20000 |
+--------+-------------+
2 rows in set (0.18 sec)

mysql>  select gender,count(name) from employee_payroll group by gender;
+--------+-------------+
| gender | count(name) |
+--------+-------------+
| F      |           2 |
| M      |           1 |
+--------+-------------+
2 rows in set (0.03 sec)



-------------------------------------------------------------------------------------------------------------------------
UC8 -> Ability to extend employee_payroll data to store employee information like employee phone, address and department
--------------------------------------------------------------------------------------------------------------------------

mysql> describe employee_payroll;
+--------+--------------+------+-----+---------+----------------+
| Field  | Type         | Null | Key | Default | Extra          |
+--------+--------------+------+-----+---------+----------------+
| id     | int unsigned | NO   | PRI | NULL    | auto_increment |
| name   | varchar(160) | NO   |     | NULL    |                |
| gender | char(1)      | YES  |     | NULL    |                |
| salary | double       | NO   |     | NULL    |                |
| start  | date         | NO   |     | NULL    |                |
+--------+--------------+------+-----+---------+----------------+
5 rows in set (0.33 sec)

mysql> alter table employee_payroll add phonenumber varchar(230) after name;
Query OK, 0 rows affected (1.05 sec)
Records: 0  Duplicates: 0  Warnings: 0

mysql> alter table employee_payroll add address varchar(250) after phonenumber;
Query OK, 0 rows affected (0.43 sec)
Records: 0  Duplicates: 0  Warnings: 0

mysql> alter table employee_payroll add department varchar(250) not null after address;
Query OK, 0 rows affected (1.38 sec)
Records: 0  Duplicates: 0  Warnings: 0

mysql> alter table employee_payroll alter address set default 'TBD';
Query OK, 0 rows affected (0.83 sec)
Records: 0  Duplicates: 0  Warnings: 0

mysql> describe employee_payroll;
+-------------+--------------+------+-----+---------+----------------+
| Field       | Type         | Null | Key | Default | Extra          |
+-------------+--------------+------+-----+---------+----------------+
| id          | int unsigned | NO   | PRI | NULL    | auto_increment |
| name        | varchar(160) | NO   |     | NULL    |                |
| phonenumber | varchar(230) | YES  |     | NULL    |                |
| address     | varchar(250) | YES  |     | TBD     |                |
| department  | varchar(250) | NO   |     | NULL    |                |
| gender      | char(1)      | YES  |     | NULL    |                |
| salary      | double       | NO   |     | NULL    |                |
| start       | date         | NO   |     | NULL    |                |
+-------------+--------------+------+-----+---------+----------------+
8 rows in set (0.02 sec)

mysql> update employee_payroll set address=default;
Query OK, 3 rows affected (0.19 sec)
Rows matched: 3  Changed: 3  Warnings: 0

mysql> select * from employee_payroll;
+----+-------------+-------------+---------+------------+--------+--------+------------+
| id | name        | phonenumber | address | department | gender | salary | start      |
+----+-------------+-------------+---------+------------+--------+--------+------------+
|  1 | Bhagyashree | NULL        | TBD     |            | F      |  15000 | 2017-06-07 |
|  2 | Basavaraj   | NULL        | TBD     |            | M      |  20000 | 2018-10-08 |
|  3 | Aishwarya   | NULL        | TBD     |            | F      |  30000 | 2019-09-05 |
+----+-------------+-------------+---------+------------+--------+--------+------------+
3 rows in set (0.01 sec)

------------------------------------------------------------------------------------------------------------
UC9 -> Ability to extend employee_payroll table to have basic pay,deductions,Taxable pay, income tax,net pay 
------------------------------------------------------------------------------------------------------------


mysql> alter table employee_payroll rename column salary to basic_pay;
Query OK, 0 rows affected (41.70 sec)
Records: 0  Duplicates: 0  Warnings: 0

mysql> alter table employee_payroll add deduction double not null after basic_pay;
Query OK, 0 rows affected (0.72 sec)
Records: 0  Duplicates: 0  Warnings: 0

mysql> alter table employee_payroll add taxable_pay double not null after deduction;
Query OK, 0 rows affected (0.34 sec)
Records: 0  Duplicates: 0  Warnings: 0

mysql> alter table employee_payroll add income_tax double not null after taxable_pay;
Query OK, 0 rows affected (0.46 sec)
Records: 0  Duplicates: 0  Warnings: 0

mysql> alter table employee_payroll add net_pay double not null after income_tax;
Query OK, 0 rows affected (12.48 sec)
Records: 0  Duplicates: 0  Warnings: 0

mysql> describe employee_payroll;
+-------------+--------------+------+-----+---------+----------------+
| Field       | Type         | Null | Key | Default | Extra          |
+-------------+--------------+------+-----+---------+----------------+
| id          | int unsigned | NO   | PRI | NULL    | auto_increment |
| name        | varchar(160) | NO   |     | NULL    |                |
| phonenumber | varchar(230) | YES  |     | NULL    |                |
| address     | varchar(250) | YES  |     | TBD     |                |
| department  | varchar(250) | NO   |     | NULL    |                |
| gender      | char(1)      | YES  |     | NULL    |                |
| basic_pay   | double       | NO   |     | NULL    |                |
| deduction   | double       | NO   |     | NULL    |                |
| taxable_pay | double       | NO   |     | NULL    |                |
| income_tax  | double       | NO   |     | NULL    |                |
| net_pay     | double       | NO   |     | NULL    |                |
| start       | date         | NO   |     | NULL    |                |
+-------------+--------------+------+-----+---------+----------------+
12 rows in set (22.51 sec)




















































































